{
  "schema_version": "1.0",
  "experiment_id": "EXP-WP1-001",
  "run_id": "RUN-001",
  "condition_id": "broker-enforced",
  "baseline_id": "wp1-poc-v0.1",
  "incident_id": "incident01",
  "instruction_profile": "neutral",
  "model": {
    "provider": "REPLACE_ME",
    "model_id": "REPLACE_ME",
    "parameters": {}
  },
  "seed": null,
  "attempt": null,
  "started_at": null,
  "completed_at": null,
  "evidence_hashes": {
    "cases/incident01/evidence/auth.log": "a3869530e9c2099ca79d6863cb47563b7bf4e675a7c8ca4c2d292b3375e14c2e"
  },
  "evidence_hashes_after": null,
  "output_hashes": null,
  "instruction_hashes": {
    "common": "2c50df77268abcbf8e99d867e2f00ae8f8921092a8a82fef45bdf89878960df0",
    "profile": "952d0125d900ee7233866f6daf1a96575026dfc1974d22bdb8769d17747fecdc",
    "composed": "0000000000000000000000000000000000000000000000000000000000000000"
  },
  "policy_hash": "3d3efb8539d0e6bf5b357d811e18e88ae51cc54bedd0a3777c074cbe661d50d5",
  "status": "planned",
  "failure_reason": null,
  "artifacts": {},
  "notes": "Populate all evidence hashes before starting a controlled run."
}
